{"baselines":["1850-1900","1951-1980","1991-2020"],"conversions":[{"from":"1951-1980","method":"per calendar month, mean of the native monthly anomaly over 1951-1980; rebased = native - offset; annual value = mean of 12 rebased months","monthly_offsets_c":[-0.0003,-0.0003,-0.0,-0.0003,0.001,-0.0,-0.0003,-0.0,-0.0003,-0.0003,-0.001,0.0003],"n_years_per_month":[30,30,30,30,30,30,30,30,30,30,30,30],"offset_c":-0.0001,"series":"gistemp_glb","to":"1951-1980"},{"from":"1951-1980","method":"per calendar month, mean of the native monthly anomaly over 1991-2020; rebased = native - offset; annual value = mean of 12 rebased months","monthly_offsets_c":[0.6293,0.6633,0.6877,0.6243,0.5787,0.5823,0.566,0.5823,0.581,0.6147,0.632,0.595],"n_years_per_month":[30,30,30,30,30,30,30,30,30,30,30,30],"offset_c":0.6114,"series":"gistemp_glb","to":"1991-2020"},{"from":"1951-1980","method":"per calendar month, mean of the native monthly anomaly over 1951-1980; rebased = native - offset; annual value = mean of 12 rebased months","monthly_offsets_c":[0.0,-0.0,-0.0007,0.0,0.0003,0.0003,0.001,-0.0003,-0.0007,-0.0,-0.0003,0.0],"n_years_per_month":[30,30,30,30,30,30,30,30,30,30,30,30],"offset_c":-0.0,"series":"gistemp_nh","to":"1951-1980"},{"from":"1951-1980","method":"per calendar month, mean of the native monthly anomaly over 1991-2020; rebased = native - offset; annual value = mean of 12 rebased months","monthly_offsets_c":[0.8033,0.8663,0.8977,0.782,0.6827,0.6673,0.637,0.6527,0.6573,0.7323,0.7803,0.7253],"n_years_per_month":[30,30,30,30,30,30,30,30,30,30,30,30],"offset_c":0.7404,"series":"gistemp_nh","to":"1991-2020"},{"from":"1951-1980","method":"per calendar month, mean of the native monthly anomaly over 1951-1980; rebased = native - offset; annual value = mean of 12 rebased months","monthly_offsets_c":[-0.0003,0.0003,-0.0007,-0.0017,0.0,0.0003,-0.0003,-0.0,0.0007,-0.0007,0.0007,-0.0007],"n_years_per_month":[30,30,30,30,30,30,30,30,30,30,30,30],"offset_c":-0.0002,"series":"gistemp_sh","to":"1951-1980"},{"from":"1951-1980","method":"per calendar month, mean of the native monthly anomaly over 1991-2020; rebased = native - offset; annual value = mean of 12 rebased months","monthly_offsets_c":[0.4533,0.4563,0.472,0.465,0.4767,0.4983,0.4997,0.5173,0.5077,0.5003,0.4857,0.464],"n_years_per_month":[30,30,30,30,30,30,30,30,30,30,30,30],"offset_c":0.483,"series":"gistemp_sh","to":"1991-2020"},{"from":"1951-1980","method":"per calendar month, mean of the native monthly anomaly over 1951-1980; rebased = native - offset; annual value = mean of 12 rebased months","monthly_offsets_c":[-0.001,-0.0003,-0.0,0.0003,-0.0003,0.0007,0.0003,0.0007,0.0003,-0.0003,0.0007,-0.0003],"n_years_per_month":[30,30,30,30,30,30,30,30,30,30,30,30],"offset_c":0.0001,"series":"gistemp_glb_landonly","to":"1951-1980"},{"from":"1951-1980","method":"per calendar month, mean of the native monthly anomaly over 1991-2020; rebased = native - offset; annual value = mean of 12 rebased months","monthly_offsets_c":[0.8187,0.864,0.8527,0.7857,0.737,0.744,0.7247,0.761,0.76,0.785,0.803,0.7893],"n_years_per_month":[30,30,30,30,30,30,30,30,30,30,30,30],"offset_c":0.7854,"series":"gistemp_glb_landonly","to":"1991-2020"},{"from":"1961-1990","method":"per calendar month, mean of the native monthly anomaly over 1850-1900; rebased = native - offset; annual value = mean of 12 rebased months","monthly_offsets_c":[-0.4273,-0.417,-0.4378,-0.3953,-0.3739,-0.3137,-0.2607,-0.2591,-0.2889,-0.3196,-0.4008,-0.4191],"n_years_per_month":[51,51,51,51,51,51,51,51,51,51,51,51],"offset_c":-0.3594,"series":"hadcrut5_glb","to":"1850-1900"},{"from":"1961-1990","method":"per calendar month, mean of the native monthly anomaly over 1951-1980; rebased = native - offset; annual value = mean of 12 rebased months","monthly_offsets_c":[-0.0973,-0.1041,-0.1408,-0.085,-0.078,-0.0636,-0.0736,-0.0621,-0.0668,-0.0637,-0.0741,-0.0869],"n_years_per_month":[30,30,30,30,30,30,30,30,30,30,30,30],"offset_c":-0.083,"series":"hadcrut5_glb","to":"1951-1980"},{"from":"1961-1990","method":"per calendar month, mean of the native monthly anomaly over 1991-2020; rebased = native - offset; annual value = mean of 12 rebased months","monthly_offsets_c":[0.5496,0.5895,0.5916,0.5743,0.5124,0.5197,0.5243,0.5502,0.5214,0.5563,0.572,0.5169],"n_years_per_month":[30,30,30,30,30,30,30,30,30,30,30,30],"offset_c":0.5482,"series":"hadcrut5_glb","to":"1991-2020"},{"from":"1961-1990","method":"per calendar month, mean of the native monthly anomaly over 1850-1900; rebased = native - offset; annual value = mean of 12 rebased months","monthly_offsets_c":[-0.5309,-0.5315,-0.5646,-0.4428,-0.3508,-0.2225,-0.1739,-0.184,-0.2477,-0.3016,-0.5077,-0.4978],"n_years_per_month":[51,51,51,51,51,51,51,51,51,51,51,51],"offset_c":-0.3797,"series":"hadcrut5_nh","to":"1850-1900"},{"from":"1961-1990","method":"per calendar month, mean of the native monthly anomaly over 1951-1980; rebased = native - offset; annual value = mean of 12 rebased months","monthly_offsets_c":[-0.0636,-0.0881,-0.1473,-0.0616,-0.0638,-0.0483,-0.0511,-0.0324,-0.0383,-0.0388,-0.0589,-0.0494],"n_years_per_month":[30,30,30,30,30,30,30,30,30,30,30,30],"offset_c":-0.0618,"series":"hadcrut5_nh","to":"1951-1980"},{"from":"1961-1990","method":"per calendar month, mean of the native monthly anomaly over 1991-2020; rebased = native - offset; annual value = mean of 12 rebased months","monthly_offsets_c":[0.7369,0.7933,0.7788,0.7721,0.6665,0.6759,0.6617,0.6889,0.6812,0.7453,0.7596,0.7001],"n_years_per_month":[30,30,30,30,30,30,30,30,30,30,30,30],"offset_c":0.7217,"series":"hadcrut5_nh","to":"1991-2020"},{"from":"1961-1990","method":"per calendar month, mean of the native monthly anomaly over 1850-1900; rebased = native - offset; annual value = mean of 12 rebased months","monthly_offsets_c":[-0.3237,-0.3025,-0.311,-0.3478,-0.397,-0.4049,-0.3475,-0.3342,-0.3301,-0.3375,-0.294,-0.3403],"n_years_per_month":[51,51,51,51,51,51,51,51,51,51,51,51],"offset_c":-0.3392,"series":"hadcrut5_sh","to":"1850-1900"},{"from":"1961-1990","method":"per calendar month, mean of the native monthly anomaly over 1951-1980; rebased = native - offset; annual value = mean of 12 rebased months","monthly_offsets_c":[-0.131,-0.1201,-0.1344,-0.1084,-0.0921,-0.0788,-0.0961,-0.0918,-0.0953,-0.0886,-0.0894,-0.1244],"n_years_per_month":[30,30,30,30,30,30,30,30,30,30,30,30],"offset_c":-0.1042,"series":"hadcrut5_sh","to":"1951-1980"},{"from":"1961-1990","method":"per calendar month, mean of the native monthly anomaly over 1991-2020; rebased = native - offset; annual value = mean of 12 rebased months","monthly_offsets_c":[0.3623,0.3857,0.4044,0.3766,0.3582,0.3636,0.387,0.4114,0.3615,0.3673,0.3844,0.3337],"n_years_per_month":[30,30,30,30,30,30,30,30,30,30,30,30],"offset_c":0.3747,"series":"hadcrut5_sh","to":"1991-2020"}],"partial_year_excluded":2026,"schema_version":"v1","series":[{"ci_hi":null,"ci_lo":null,"ci_note":null,"domain":"land_ocean","first_year":1880,"id":"gistemp_glb","label":"GISTEMP global land-ocean","last_year":2025,"native_baseline":"1951-1980","region":"global","source":"NASA GISTEMP v4","values":{"1951-1980":[null,null,null,null,null,null,null,null,null,null,null,null,null,null,null,null,null,null,null,null,null,null,null,null,null,null,null,null,null,null,-0.172,-0.087,-0.112,-0.176,-0.282,-0.333,-0.313,-0.362,-0.177,-0.107,-0.355,-0.224,-0.272,-0.312,-0.303,-0.227,-0.112,-0.111,-0.275,-0.177,-0.084,-0.155,-0.282,-0.371,-0.472,-0.258,-0.217,-0.381,-0.422,-0.482,-0.434,-0.442,-0.366,-0.342,-0.154,-0.138,-0.36,-0.457,-0.297,-0.274,-0.268,-0.183,-0.282,-0.262,-0.268,-0.218,-0.105,-0.214,-0.198,-0.36,-0.153,-0.089,-0.157,-0.284,-0.128,-0.2,-0.15,-0.031,-0.002,-0.021,0.122,0.181,0.063,0.087,0.203,0.094,-0.071,-0.027,-0.107,-0.111,-0.175,-0.071,0.01,0.082,-0.133,-0.14,-0.189,0.048,0.061,0.031,-0.025,0.057,0.031,0.053,-0.2,-0.108,-0.057,-0.023,-0.083,0.053,0.028,-0.08,0.009,0.161,-0.072,-0.012,-0.097,0.178,0.067,0.164,0.257,0.323,0.139,0.315,0.155,0.118,0.18,0.322,0.388,0.273,0.448,0.406,0.223,0.231,0.313,0.445,0.333,0.465,0.608,0.383,0.393,0.533,0.628,0.616,0.534,0.678,0.643,0.665,0.543,0.657,0.723,0.608,0.646,0.674,0.747,0.895,1.01,0.913,0.848,0.978,1.005,0.848,0.89,1.168,1.282,1.185],"1991-2020":[null,null,null,null,null,null,null,null,null,null,null,null,null,null,null,null,null,null,null,null,null,null,null,null,null,null,null,null,null,null,-0.784,-0.699,-0.723,-0.787,-0.894,-0.945,-0.925,-0.973,-0.788,-0.719,-0.966,-0.836,-0.884,-0.923,-0.915,-0.838,-0.723,-0.722,-0.886,-0.789,-0.696,-0.766,-0.894,-0.982,-1.084,-0.87,-0.829,-0.992,-1.034,-1.094,-1.046,-1.054,-0.977,-0.954,-0.766,-0.75,-0.971,-1.069,-0.908,-0.886,-0.88,-0.795,-0.894,-0.874,-0.88,-0.83,-0.716,-0.826,-0.81,-0.971,-0.765,-0.701,-0.769,-0.896,-0.74,-0.811,-0.761,-0.642,-0.614,-0.632,-0.49,-0.431,-0.548,-0.525,-0.409,-0.517,-0.682,-0.639,-0.719,-0.722,-0.786,-0.682,-0.601,-0.53,-0.745,-0.751,-0.801,-0.564,-0.551,-0.581,-0.636,-0.555,-0.581,-0.558,-0.811,-0.72,-0.668,-0.635,-0.695,-0.559,-0.584,-0.691,-0.602,-0.451,-0.683,-0.624,-0.708,-0.434,-0.545,-0.447,-0.355,-0.289,-0.472,-0.296,-0.456,-0.493,-0.431,-0.29,-0.223,-0.339,-0.163,-0.206,-0.389,-0.381,-0.298,-0.166,-0.278,-0.146,-0.003,-0.229,-0.218,-0.078,0.017,0.004,-0.077,0.067,0.031,0.054,-0.069,0.045,0.111,-0.004,0.034,0.063,0.135,0.284,0.399,0.301,0.237,0.366,0.394,0.236,0.279,0.556,0.67,0.574]}},{"ci_hi":null,"ci_lo":null,"ci_note":null,"domain":"land_ocean","first_year":1880,"id":"gistemp_nh","label":"GISTEMP Northern Hemisphere","last_year":2025,"native_baseline":"1951-1980","region":"nh","source":"NASA GISTEMP v4","values":{"1951-1980":[null,null,null,null,null,null,null,null,null,null,null,null,null,null,null,null,null,null,null,null,null,null,null,null,null,null,null,null,null,null,-0.299,-0.186,-0.222,-0.294,-0.432,-0.442,-0.437,-0.439,-0.241,-0.181,-0.396,-0.261,-0.394,-0.472,-0.385,-0.303,-0.195,-0.163,-0.287,-0.212,-0.089,-0.125,-0.337,-0.379,-0.487,-0.282,-0.229,-0.464,-0.449,-0.493,-0.447,-0.424,-0.47,-0.4